A1: 1 | B1: ='de Broqueville'!I1 -> de Broqueville Pierre | C1: ='de Broqueville'!J34 -> 944.35510579484753
A2: 2 | B2: =Colson!I1 -> Colson Jean-Luc | C2: =Colson!J34 -> 937.77874999999995
A3: 3 | B3: ='Jeanmotte Y'!I1 -> Jeanmotte Yves | C3: ='Jeanmotte Y'!J34 -> 934.89400000000012
A4: 4 | B4: ='Schmeltzer B'!I1 -> Schmelzer Bert | C4: ='Schmeltzer B'!J34 -> 928.3462540904809
A5: 5 | B5: ='Litt M'!I1 -> Litt Manu | C5: ='Litt M'!J34 -> 927.70896269885054
A6: 6 | B6: ='Huybreckx D'!I1 -> Huybreckx Dennis | C6: ='Huybreckx D'!J34 -> 899.04208536577767
A7: 7 | B7: =Akkermans!I1 -> Akkermans Wim | C7: =Akkermans!J34 -> 897.25862065792501
A8: 8 | B8: ='Schmeltzer T '!I1 -> Schmelzer Tijl | C8: ='Schmeltzer T '!J34 -> 885.82532469754915
A9: 9 | B9: ='Jeanmotte M'!I1 -> Jeanmotte Michaël | C9: ='Jeanmotte M'!J34 -> 861.40598663336743
A10: 10 | B10: =Brialmont!I1 -> Brialmont Olivier | C10: =Brialmont!J34 -> 861.40086701484563
A11: 11 | B11: ='Huybreckx T'!I1 -> Huybreckx Tim | C11: ='Huybreckx T'!J34 -> 861.25855879898472
A12: 12 | B12: ='Litt B'!I1 -> Litt Baudouin | C12: ='Litt B'!J34 -> 861.24880996635829
A13: 13 | B13: =jaime!I1 -> Jaime José | C13: =jaime!J34 -> 825.67903014642195
A14: 14 | B14: =Marenne!I1 -> Marenne Laurent | C14: =Marenne!J34 -> 825.10568187680235
A15: 15 | B15: =Stouffs!I1 -> Stouffs Patrick | C15: =Stouffs!J34 -> 824.83955227736067
A16: 16 | B16: =Vanderputten!I1 -> Vanderputten Koen | C16: =Vanderputten!J34 -> 822.59758348463254
A17: 17 | B17: =Dewachter!I1 -> Dewachter Emiel | C17: =Dewachter!J34 -> 821.34891742523712
A18: 18 | B18: =Corneillie!I1 -> Corneillie Olivier | C18: =Corneillie!J34 -> 817.53790134789335
A19: 19 | B19: =Vandingene!I1 -> Vandingene Paul | C19: =Vandingene!J34 -> 815.73379980658422
A20: 20 | B20: =Mercier!I1 -> Mercier Sébastien | C20: =Mercier!J34 -> 815.1628961708625
A21: 21 | B21: =Hanssens!I1 -> Hanssens Pascal | C21: =Hanssens!J34 -> 812.2184716690972
A22: 22 | B22: =Delfosse!I1 -> Delfosse François | C22: =Delfosse!J34 -> 789.72720356110722
A23: 23 | B23: =Spruyt!I1 -> Spruyt Daan | C23: =Spruyt!J34 -> 785.73827698245998
A24: 24 | B24: Leveau Corentin | C24: =Leveau!J34 -> 782.5648527267424
A25: 25 | B25: =Lemineur!I1 -> Lemineur Thierry | C25: =Lemineur!J34 -> 752.56412424541486
A26: 26 | B26: =Natowitz!I1 -> Natowitz Larry | C26: =Natowitz!J34 -> 741.65818294516293
A27: 27 | B27: =Kell!I1 -> Kell Jef | C27: =Kell!J34 -> 734.35881383832418
A28: 28 | B28: =Hotton!I1 -> Hotton Jean-Claude | C28: =Hotton!J34 -> 721.32745450281425
A29: 29 | B29: =Luyckx!I1 -> Luyckx Johan | C29: =Luyckx!J34 -> 706.77092107706585
A30: 30 | B30: Peeraer herman | C30: =Peeraer!J34 -> 703.1159357200977
A31: 31 | B31: Van Gestel Dries | C31: ='Van Gestel'!J34 -> 691.3950391061453
A32: 32 | B32: Schmelzer Bert Senior | C32: ='Schmeltzer B Snr'!J34 -> 691.08033454233725
A33: 33 | B33: =Leduc!I1 -> Leduc Jean-Philippe | C33: =Leduc!J34 -> 677.1746480965644
A34: 34 | B34: =Paepe!I1 -> Paepe Frederic | C34: =Paepe!J34 -> 676.60042760149668
A35: 35 | B35: =Ruymen!I1 -> Ruymen Yves | C35: =Ruymen!J34 -> 673.66396916099461
A36: 36 | B36: Cornez Jean-Louis | C36: =Cornez!J34 -> 670.28408833743549
A37: 37 | B37: Schoeters Jochen | C37: ='Schoeters J'!J34 -> 665.19645120405585
A38: 38 | B38: Lievens Pieter | C38: ='Lievens P'!J34 -> 646.13151092222245
A39: 39 | B39: =Renard!I1 -> Renard Pierre | C39: =Renard!J34 -> 643.74032352941174
A40: 40 | B40: De Keersmacker Bart | C40: ='De Keersmaecker'!J34 -> 640.78824551569505
A41: 41 | B41: Jennen Jeroen | C41: =Jennen!J34 -> 630.88757678812408
A42: 42 | B42: Schram Christophe | C42: =Schram!J34 -> 607.73911125849781
A43: 43 | B43: =Pieraerts!I1 -> Pieraerts Bruno | C43: =Pieraerts!J34 -> 604.38707427512475
A44: 44 | B44: =Bouillon!I1 -> Bouillon Marc | C44: =Bouillon!J34 -> 572.68835840297129
A45: 45 | B45: Van den Boer Stijn | C45: ='Van den Boer S'!J34 -> 558.72241438967967
A46: 46 | B46: ='Severin O'!I1 -> Severin Olivier | C46: ='Severin O'!J34 -> 556.3060354703041
A47: 47 | B47: Deijgers Niel | C47: =Deijgers!J34 -> 554.86516134372164
A48: 48 | B48: Van den Boer Rik | C48: ='Van den Boer R'!J34 -> 517.69343970132115
A49: 49 | B49: Bovin Stefan | C49: =Bovin!J34 -> 514.42720911310016
A50: 50 | B50: Pieter Beckx | C50: =Beckx!J34 -> 507.26634662327103
A51: 51 | B51: ='Lievens J'!I1 -> Lievens Johan | C51: ='Lievens J'!J34 -> 496.14976234854657
A52: 52 | B52: Vandebeek Jelle | C52: =Vandebeeck!J34 -> 487.5739747762409
A53: 53 | B53: ='Severin M'!I1 -> Severin Manu | C53: ='Severin M'!J34 -> 466.7749769325178
A54: 54 | B54: =Defooz!I1 -> Defooz Philippe | C54: =Defooz!J34 -> 447.07821874999991
A55: 55 | B55: =Dresse!I1 -> Dresse Louis | C55: =Dresse!J34 -> 433.70033611884861
A56: 56 | B56: Mertens Hugo | C56: =Mertens!J34 -> 402.39468242245209
A57: 57 | B57: Gillegot Jan | C57: =Gillegot!J34 -> 397.59800000000007
A58: 58 | B58: ='Evrard O'!I1 -> Evrard Olivier | C58: ='Evrard O'!J34 -> 366.70131661442008
A59: 59 | B59: Schoeters Michaela | C59: ='Schoeters M'!J34 -> 348.26086956521738
A60: 60 | B60: Dupont Olivier | C60: =Dupont!J34 -> 297.91511570654848
A61: 61 | B61: Petitfrère Denis | C61: =Petitfrere!J34 -> 293.69635738831613
A62: 62 | B62: Van der linden Fabienne | C62: ='Van Der Linden'!J34 -> 225.36841713221605